codigo;nombre;acronimo;curso;semestre;tipo;creditos
93000651;FUNDAMENTOS DE CELULAS SOLARES;;1;1S;obl;4
93000652;ENERGIA Y SOCIEDAD;;1;1S;obl;4
93000653;LABORATORIO DE MODULOS E INSTALACIONES FOTOVOLTAICAS;;1;2S;obl;4
93000654;LABORATORIO DE CARACTERIZACION DE CELULAS SOLARES;;1;1S;obl;4
93000655;INGENIERIA DE LOS SISTEMAS FOTOVOLTAICOS;;1;2S;obl;4
93000656;INGENIERIA ELECTRICA DE LOS SISTEMAS FOTOVOLTAICOS;;1;1S;opt;4
93000657;LABORATORIO DE TECNOLOGIA DE CELULAS SOLARES;;1;1S;opt;6
93000658;FISICA DE MATERIALES FOTOVOLTAICOS;;1;1S;opt;4
93000659;INGENIERIA OPTICA;;1;1S;opt;5
93000661;SISTEMAS CONECTADOS A LA RED ELECTRICA;;1;2S;opt;4
93000663;CELULAS SOLARES DE NUEVA GENERACION;;1;2S;opt;3
93000664;INTEGRACION ARQUITECTONICA DE LA ENERGIA SOLAR FOTOVOLTAICA;;1;2S;opt;2
93000665;LABORATORIO DE SISTEMAS FOTOVOLTAICOS DE CONCENTRACION;;1;2S;opt;4
93000666;LABORATORIO DE SIMULACION DE CELULAS Y SISTEMAS;;1;2S;opt;4
93000667;LABORATORIO DE INGENIERIA ELECTRICA FOTOVOLTAICA;;1;2S;opt;4
93000668;LABORATORIO COMPUTACIONAL DE MATERIALES FOTOVOLTAICOS;;1;2S;opt;4
93000669;SEMINARIO DE ACTUALIDAD ENERGETICA;;1;1S;opt;4
93000670;SEMINARIO SOBRE MERCADO FOTOVOLTAICO, FINANCIACION Y GESTION;;1;2S;opt;4
93000673;INTEGRACION ARQUITECTONICA DE LA ENERGIA SOLAR FOTOVOLTAICA. SEMINARIO;;1;2S;opt;1
93000674;TRABAJO FIN DE MASTER;;1;I;obl;15
93000791;SISTEMAS DE COMUNICACIONES;SCOM;1;1S-2S;obl;6
93000792;ANÁLISIS DE SEÑAL PARA COMUNICACIONES;ASEC;1;1S-2S;obl;6
93000793;TECNOLOGIAS DE ACCESO RADIO;TACR;1;1S-2S;obl;3
93000794;SISTEMAS Y SERVICIOS MULTIMEDIA;SSMM;1;1S-2S;obl;6
93000795;EQUIPOS Y TERMINALES DE USUARIO;EYTU;1;1S-2S;obl;6
93000796;INGENIERÍA DE SISTEMAS DE INSTRUMENTACIÓN;ISIN;1;1S-2S;obl;6
93000797;REDES DE COMUNICACIONES;RECM;1;2S;obl;6
93000798;APLICACIONES Y SERVICIOS;APSV;1;1S;obl;6
93000799;INTEGRACION DE REDES, APLICACIONES Y CONTENIDOS;IRAC;1;2S;obl;6
93000800;GESTION DE PROYECTOS;GPRO;1;1S;obl;6
93000801;VISIÓN ESTRATÉGICA DE LA INTEGRACIÓN DE TECNOLOGÍAS Y SISTEMAS EN EL SECTOR TIC;VETIC;1;1S-2S;obl;3
93000802;ARQUITECTURAS AVANZADAS DE TRANSMISION/RECEPCION;AQTR;2;2S;opt;6
93000803;ANTENAS;ANTE;2;1S;opt;6
93000804;CIRCUITOS DE ALTA FRECUENCIA;CAFR;2;1S;opt;6
93000805;TALLER DE TECNOLOGIAS DE ALTA FRECUENCIA;TTAF;2;2S;opt;6
93000806;MEDIA DATA SYSTEM DESIGN;EPAV;2;2S;opt;6
93000807;TELEVISIÓN;TEVI;2;;opt;6
93000808;TRANSMISION Y RECEPCION DE IMAGEN Y SONIDO;TRIS;2;1S;opt;6
93000809;TALLER DE SISTEMAS AUDIOVISUALES;TTAF;2;;opt;6
93000810;COMUNICACIONES MÓVILES;CMOV;2;2S;opt;6
93000811;COMUNICACIONES POR SATÉLITE;CSAT;2;1S;opt;6
93000812;COMUNICACIONES POR FIBRA OPTICA;CFOP;2;2S;opt;6
93000813;TALLER DE SISTEMAS DE COMUNICACIONES;TSCO;2;2S;opt;6
93000814;COMUNICACIONES POR SATÉLITE;CSAT;2;1S;opt;6
93000815;SISTEMAS RADAR;SRAD;2;1S;opt;6
93000816;SISTEMAS DE RADIONAVEGACIÓN;SRNV;2;;opt;6
93000817;TALLER DE ESPACIO Y SEGURIDAD;TESG;2;2S;opt;6
93000818;EQUIPOS DE RADIO DEFINIDOS POR SOFTWARE;RADS;2;1S;opt;6
93000819;TRATAMIENTO DE LA SEÑAL ACÚSTICA;TSAC;2;2S;opt;6
93000820;TRATAMIENTO DIGITAL DE VIDEO;TSVD;2;1S;opt;6
93000821;TALLER DE TRATAMIENTO DE SEÑALES;TTSÑ;2;2S;opt;6
93000822;CIENCIA DE DATOS Y APRENDIZAJE AUTOMÁTICO EN LA WEB DE DATOS;SITC;2;2S;opt;6
93000823;TECNOLOGÍAS DE GESTIÓN DE PROCESOS DE NEGOCIO;TGPN;2;1S-2S;opt;6
93000824;CIBERSEGURIDAD Y PRIVACIDAD: GESTIÓN Y OPERACIÓN;SSSI;2;2S;opt;6
93000825;TALLER DE SERVICIOS TELEMATICOS Y PROCESOS DE NEGOCIO;TTSP;2;2S;opt;6
93000826;APLICACIONES Y SERVICIOS UBICUOS Y EN MOVILIDAD;ASUM;2;2S;opt;6
93000827;COMPUTACION EN NUBE Y VIRTUALIZACION DE REDES Y SERVICIOS;CNVR;2;1S;opt;6
93000828;APLICACIONES Y REDES MULTIMEDIA;ARMM;2;2S;opt;6
93000829;TALLER DE SERVICIOS EN INTERNET  MULTIMEDIA Y MOVILIDAD;TTST;2;1S-2S;opt;6
93000830;EVOLUCION DE REDES MOVILES, INALAMBRICAS Y POR SATELITE;EVRD;2;2S;opt;6
93000831;INTERNET Y REDES DE PRÓXIMA GENERACIÓN;IRPG;2;1S-2S;opt;6
93000832;ARQUITECTURAS DE CONMUTACIÓN Y TRANSPORTE;AQCT;2;1S-2S;opt;6
93000833;REDES DEFINIDAS POR SOFTWARE, VIRTUALIZACIÓN Y SERVICIOS AVANZADOS DE RED;TTRC;2;1S;opt;6
93000834;INGENIERÍA DE SISTEMAS CON PROCESADORES;ISPR;2;2S;opt;6
93000835;DISEÑO MICROELECTRÓNICO;DMEL;2;1S;opt;6
93000836;TECNOLOGÍA MICROELECTRÓNICA;TMEL;2;2S;opt;6
93000837;ENERGIA SOLAR FOTOVOLTAICA;ESFV;2;1S;opt;6
93000838;DISPOSITIVOS FOTONICOS;DFOT;2;2S;opt;6
93000839;NANOELECTRONICA;NELC;2;2S;opt;6
93000840;DISPOSITIVOS SEMICONDUCTORES;DSMC;2;1S;opt;6
93000841;FUNDAMENTOS DE BIOINGENIERIA;FBIO;2;1S;opt;6
93000842;SEÑALES E IMÁGENES MÉDICAS;SÑIM;2;1S;opt;6
93000843;TELEMEDICINA;TMED;2;1S;opt;6
93000844;INGENIERIA NEUROSENSORIAL;INRS;2;1S;opt;6
93000845;BIOSENSORES;BIOS;2;2S;opt;6
93000846;DIRECCION Y ADMINISTRACION DE EMPRESAS;DAEM;2;1S;opt;4.5
93000847;SISTEMAS DE INFORMACIÓN PARA LA GESTIÓN EMPRESARIAL;SIG1;2;1S;opt;4.5
93000848;INNOVACIÓN TECNOLÓGICA Y DE NEGOCIO;INTN;2;1S;opt;4.5
93000849;ESTRATEGIAS Y TÉCNICAS PARA LA TOMA DE DECISIONES;ETTD;2;1S;opt;4.5
93000850;POLITICAS Y REGULACION DE LOS MERCADOS TIC;RTIC;2;2S;opt;3
93000851;GESTIÓN FINANCIERA DE LA EMPRESA;GFEM;2;;opt;3
93000852;SISTEMAS Y TECNOLOGÍAS DE LA INFORMACIÓN PARA LA GESTIÓN EMPRESARIAL II;SIG2;2;2S;opt;3
93000853;CREACION DE EMPRESAS TECNOLOGICAS;CETC;2;2S;opt;3
93000854;ANÁLISIS DE DATOS E INTELIGENCIA DE NEGOCIO;ADIN;2;2S;opt;3
93000855;ANALISIS DEL NEGOCIO TIC;NTIC;2;2S;opt;3
93000856;ANÁLISIS DE LA DEMANDA Y PROSPECTIVA DEL MERCADO TIC;DTIC;2;;;3
93000860;PRÁCTICAS DE EMPRESA;;2;I;opt;6
93000870;TRABAJO FIN DE MÁSTER;TFM;2;1S-2S;obl;30
93000871;TECNICAS NUMERICAS;;1;1S;obl;3
93000872;TECNICAS DE OPTIMIZACION;TOPT;1;1S;obl;3
93000873;TECNICAS DE MONTE CARLO;TMON;1;1S;obl;3
93000874;SOFTWARE ESTADISTICO;SWES;1;1S;obl;3
93000875;METODOS DE ANALISIS MULTIVARIANTE;AMUL;1;1S;bas;3
93000876;METODOS DE REGRESION Y PREDICCION;MREG;1;1S;bas;3
93000877;REDES NEURONALES Y APRENDIZAJE ESTADÍSTICO;RNAE;1;1S;obl;3
93000878;TECNICAS DE RECONOCIMIENTO DE PATRONES;TRPA;1;1S;obl;3
93000879;MINERIA DE DATOS;MDAT;1;1S;obl;3
93000880;SERIES TEMPORALES;STMP;1;1S;obl;3
93000883;CALCULO ESTOCASTICO EN FINANZAS;CEFI;1;2S;opt;3
93000884;METODOS NUMERICOS EN FINANZAS;MNFI;1;2S;opt;3
93000885;TEORIA DE JUEGOS;TJUE;1;2S;opt;3
93000886;MODELIZACION CON INCERTIDUMBRE. INFORMACION DIFUSA Y SOFT COMPUTING;IDIF;1;2S;opt;3
93000887;ANALISIS Y MODELIZACION DE DATOS CATEGORICOS. APLICACIONES;ADAC;1;2S;opt;3
93000888;ANALISIS DE REDES SOCIALES;ARES;1;2S;obl;3
93000889;METODOS TIEMPO-FRECUENCIA E IMÁGENES;MTFI;1;2S;obl;3
93000890;MUNDO INTERCONECTADO. UNA INTRODUCCION PRACTICA A LA CIENCIA DE LAS REDES;MINT;1;2S;opt;3
93000891;TRABAJO FIN DE MASTER;TFM;1;I;obl;12
93000895;PRACTICAS EN EMPRESA;;2;I;opt;3
93000896;BIG DATA: FUNDAMENTOS E INFRAESTRUCTURAS;SIBD;2;1S;opt;6
93000898;ESTADISTICA BAYESIANA;ESBY;1;2S;opt;3
93000899;APLICACIONES Y SERVICIOS AVANZADOS DE INTERNET;ASAI;1;2S;obl;4.5
93000900;ARQUITECTURA Y GESTION DE SERVICIOS TELEMATICOS;AGST;1;1S;bas;4.5
93000901;REDES DE DATOS POR SATELITE: VSAT, MOVILES Y POR DIFUSION DE TV;RSVM;1;1S;obl;4.5
93000902;SEGURIDAD EN REDES DE TELECOMUNICACION;SEGR;1;2S;obl;4.5
93000903;SIMULACION DE REDES DE COMUNICACIONES;SIRC;1;1S;obl;4.5
93000904;SISTEMAS DE INFORMACION Y BASES DE DATOS WEB;SBDW;1;1S;obl;4.5
93000905;TEMAS AVANZADOS DE REDES DE ORDENADORES;TARO;1;1S;obl;4.5
93000906;TECNOLOGÍAS INTELIGENTES PARA ANÁLISIS DE DATOS;TIAD;1;2S;obl;4.5
93000907;FUNDAMENTOS DE SISTEMAS DE INFORMACIÓN PARA BIG DATA;FBID;1;1S;opt;4.5
93000908;SISTEMAS DISTRIBUIDOS Y COMPUTACIÓN EN LA NUBE;SDCN;1;1S;opt;4.5
93000909;TRABAJO FIN DE MASTER;TFM;1;I;obl;15
93000910;PROGRAMAS DE INTERCAMBIO OPTATIVA I;;2;I;opt;6
93000911;PROGRAMAS DE INTERCAMBIO OPTATIVA II;;2;I;opt;6
93000912;PROGRAMAS DE INTERCAMBIO OPTATIVA III;;2;I;opt;18
93000913;PROGRAMAS DE INTERCAMBIO OPTATIVA IV;;2;I;opt;3
93000914;PROGRAMAS DE INTERCAMBIO OPTATIVA V;;2;I;opt;3
93000915;PROGRAMAS DE INTERCAMBIO OPTATIVA VI;;2;I;opt;4.5
93000916;PROGRAMAS DE INTERCAMBIO OPTATIVA VII;;2;I;opt;4.5
93000917;PROGRAMAS DE INTERCAMBIO OPTATIVA VIII;;2;I;opt;15
93000918;HERRAMIENTAS INFORMATICAS PARA BIG DATA;HIBD;1;2S;opt;3
93000960;ORGANIZACIÓN DE EMPRESAS DE TECNOLOGÍA MÉDICA;OETM;1;1S;bas;3
93000961;DISEÑO DE TECNOLOGÍAS BIOMÉDICAS;DTB;1;1S;obl;3
93000962;PROYECTOS DE INVESTIGACIÓN Y DESARROLLO DE IB;PID;1;1S;bas;3
93000963;PROYECTOS PROFESIONALES EN IB;PPIB;1;2S;bas;6
93000964;TELEMEDICINA;TEL;1;1S;opt;3
93000965;MODELADO DE SISTEMAS BIOMÉDICOS;MOD;1;1S;obl;3
93000966;BIOINSTRUMENTACIÓN;BINS;1;1S;opt;3
93000967;IMÁGENES MÉDICAS;IBIO;1;1S;obl;3
93000968;SEÑALES BIOMÉDICAS;SBIO;1;1S;opt;3
93000969;BIOMECÁNICA;BMEC;1;1S;opt;3
93000970;GESTIÓN E INNOVACIÓN EMPRESARIAL EN IB;GEIB;1;1S;obl;3
93000971;ANÁLISIS INTELIGENTE DE DATOS MÉDICOS;AIDM;1;1S;obl;3
93000972;CONTROL Y ROBÓTICA EN MEDICINA;ROB;1;1S;opt;3
93000973;MEDICINA PERSONALIZADA;MPE;1;1S;opt;3
93000974;TEMAS AVANZADOS EN SEÑALES E IMÁGENES MÉDICAS;TSIM;1;1S;obl;3
93000975;TECNOLOGÍAS PARA NANOMEDICINA;NANO;1;1S;obl;3
93000976;CIRUGÍA GUIADA POR IMAGEN;;1;2S;obl;3
93000977;TEMAS AVANZADOS DE IMÁGENES BIOMÉDICAS-II;TAIM;1;2S;obl;3
93000978;LABORATORIO DE SEÑALES BIOMÉDICAS;LSEÑ;1;2S;opt;3
93000979;LABORATORIO DE IMÁGENES MÉDICAS;LIM;1;2S;opt;3
93000980;INTELIGENCIA AMBIENTAL;INAM;1;2S;opt;3
93000981;TECNOLOGÍAS ASISTIVAS;TEAS;1;2S;obl;3
93000982;LABORATORIO DE TELEMEDICINA;LTEL;1;2S;opt;3
93000983;BIOFOTÓNICA;BIOF;1;2S;opt;3
93000984;BIOELECTROMAGNETISMO;BEMG;1;2S;opt;3
93000985;LABORATORIO DE BIOINSTRUMENTACIÓN;LINS;1;2S;opt;3
93000986;MODELOS NUMÉRICOS PARA BIOMECÁNICA DE TEJIDOS Y DEL FLUJO SANGUÍNEO;MOD;1;2S;opt;3
93000987;LABORATORIO DE BIOMECÁNICA;LMEC;1;2S;obl;3
93000988;MEDICINA REGENERATIVA;MERE;1;2S;opt;3
93000989;PRÁCTICAS EXTERNAS;;1;I;opt;3
93000990;SEMINARIOS CLÍNICOS;;1;1S;obl;3
93000991;TRABAJO FIN DE MÁSTER;;1;I;obl;15
93000992;PRÁCTICAS EXTERNAS;PE;1;I;opt;3
93000993;PRÁCTICAS EXTERNAS;PE;1;I;opt;6
93000994;APLICACIONES Y DESPLIEGUE EN NUBES;;1;1S;obl;4.5
93000995;APLICACIONES DE BIG DATA EN NUBES;;1;1S;obl;4.5
93000996;APLICACIONES DE FLUJO AUDIO/VIDEO EN NUBES;;1;1S;obl;4.5
93000997;DISEÑO DE SEGURIDAD, PRIVACIDAD Y SERVICIO;;1;2S;obl;4.5
93000998;MINI-PROYECTO I;;1;1S;obl;3
93000999;MINI-PROYECTO II;;1;2S;obl;3
93001000;ESTUDIO DE INNOVACIÓN Y EMPRENDIMIENTO;;1;I;obl;6
93001001;PROYECTO FIN DE MÁSTER;;1;I;obl;30
93001002;CIBERSEGURIDAD: CONTEXTO Y AMENAZAS;CSCA;1;1S;bas;6
93001003;AUDITORÍA TÉCNICA DE SEGURIDAD;AUTS;1;1S;bas;3
93001004;EVIDENCIAS FORENSES;EVFO;1;2S;obl;3
93001005;SERVICIOS DE CONTROL DE ACCESO;SECA;1;1S;bas;4.5
93001006;SERVICIOS DE SEGURIDAD EN RED;SESR;1;1S;obl;3
93001007;PROTECCIÓN DE SISTEMAS Y SERVICIOS;PRSS;1;1S;obl;4.5
93001008;PROTECCIÓN DE LA INFORMACIÓN;PRIN;1;1S;bas;3
93001009;SEGURIDAD EN EL DESARROLLO SOFTWARE;SEDS;1;2S;obl;3
93001010;INGENIERÍA INVERSA Y ANÁLISIS DE MALWARE;IIAM;1;1S;bas;6
93001011;GESTIÓN DE RIESGOS Y OPERACIONES EN CIBERSEGURIDAD;GROC;1;2S;bas;6
93001012;DISEÑO DE ESTRATEGIAS CORPORATIVAS DE CIBERSEGURIDAD;DECC;1;2S;opt;3
93001013;SISTEMAS DE GESTIÓN DE SEGURIDAD DE LA INFORMACIÓN;SGSI;1;2S;opt;3
93001014;SEGURIDAD FÍSICA Y CONVERGENCIA;;1;2S;opt;3
93001015;PRÁCTICAS EN EMPRESA;;1;I;opt;6
93001016;TRABAJO FIN DE MÁSTER;TFM;1;I;obl;12
93001017;INGENIERÍA DE SISTEMAS ELECTRÓNICOS ANALÓGICOS Y DIGITALES;SEAD;1;1S;bas;6
93001018;LABORATORIO DE CIRCUITOS Y SISTEMAS ELECTRÓNICOS;LCSE;1;1S;bas;4
93001019;METODOLOGÍA, CALIDAD Y HABILIDADES PERSONALES;MCHP;1;A;obl;5
93001020;AVANCES EN INGENIERÍA DE SISTEMAS ELECTRÓNICOS;SEMN;1;A;bas;3
93001021;SISTEMAS EMPOTRADOS;SEMP;1;1S;obl;4
93001022;SISTEMAS ANALÓGICOS;SEAN;1;2S;bas;4
93001023;DISEÑO ELECTRÓNICO ORIENTADO A PRODUCTO;DEOP;1;2S;bas;4
93001024;LABORATORIO DE SISTEMAS ELECTRÓNICOS;LSEL;1;2S;bas;3
93001025;MICROELECTRÓNICA;MCRE;1;1S;obl;4
93001026;POTENCIA Y CONTROL;POTC;1;2S;opt;4
93001027;SISTEMAS EMPOTRADOS AVANZADOS;SEMA;1;2S;obl;4
93001028;ARQUITECTURAS DIGITALES AVANZADAS;ADAV;1;2S;obl;4
93001029;INTELIGENCIA EN SISTEMAS ELECTRÓNICOS;INSE;1;2S;obl;4
93001030;TRABAJO FIN DE MÁSTER;TFM;1;I;obl;15
93001034;FUNDAMENTOS DE CELULAS SOLARES;FCS;1;1S;bas;4
93001035;ENERGIA Y SOCIEDAD;EyS;1;1S;obl;5
93001036;LABORATORIO DE CARACTERIZACION DE CELULAS SOLARES;LCCS;1;1S;bas;4
93001037;INGENIERIA DE LOS SISTEMAS FOTOVOLTAICOS;ISFV;1;1S;obl;4
93001038;INGENIERIA ELECTRICA DE LOS SISTEMAS FV;IESFV;1;1S;opt;4
93001039;LABORATORIO DE TECNOLOGIA DE CELULAS SOLARES;LTCS;1;1S;opt;5
93001040;FISICA DE LOS MATERIALES FOTOVOLTAICOS;FMFV;1;1S;obl;4
93001041;INGENIERIA OPTICA;IO;1;1S;opt;4
93001042;SEMINARIO DE ACTUALIDAD ENERGETICA;SEM1;1;1S;opt;4
93001043;TRABAJO FIN DE MASTER;TFM;1;I;obl;15
93001044;LABORATORIO DE MODULOS E INSTALACIONES FV;LMI;1;2S;bas;4
93001045;SISTEMAS CONECTADOS A LA RED ELECTRICA;SCRE;1;2S;opt;4
93001046;CELULAS SOLARES DE NUEVA GENERACION;CSNG;1;2S;obl;3
93001047;INTEGRACION ARQUITECTONICA DE LA ENERGIA SOLAR FOTOVOLTAICA;IA;1;2S;opt;4
93001048;LABORATORIO DE SISTEMAS FV DE CONCENTRACION;LSFVC;1;2S;obl;4
93001049;LABORATORIO DE SIMULACION DE CELULAS Y SISTEMAS;LS;1;2S;obl;4
93001050;LABORATORIO DE INGENIERIA ELECTRICA FOTOVOLTAICA;LIEFV;1;2S;obl;4
93001051;SEMINARIO SOBRE MERCADO FV  FINANCIACION Y GESTION;SEM2;1;2S;obl;4
93001052;LABORATORIO COMPUTACIONAL DE MATERIALES FOTOVOLTAICOS;LCMFV;1;2S;obl;4
93001053;PROGRAMA DE INTERCAMBIO OBLIGATORIA 6 ECTS;;1;2S;obl;6
93001054;PROGRAMA DE INTERCAMBIO OBLIGATORIA 3 ECTS 1;;1;2S;obl;3
93001055;PROGRAMA DE INTERCAMBIO OBLIGATORIA 3 ECTS 2;;1;2S;obl;3
93001056;PROGRAMA DE INTERCAMBIO OPTATIVA 9 ECTS;;1;2S;opt;9
93001057;PROGRAMA DE INTERCAMBIO OPTATIVA 4,5 ECTS 1;;1;2S;opt;4.5
93001058;PROGRAMA DE INTERCAMBIO OPTATIVA 4,5 ECTS 2;;1;2S;opt;4.5
93001059;PROGRAMA DE INTERCAMBIO OPTATIVA 6 ECTS 1;;1;2S;opt;6
93001060;PROGRAMA DE INTERCAMBIO OPTATIVA 6 ECTS 2;;1;2S;opt;6
93001061;PROGRAMA DE INTERCAMBIO OPTATIVA 3 ECTS 1;;1;2S;opt;3
93001062;PROGRAMA DE INTERCAMBIO OPTATIVA 3 ECTS 2;;1;2S;opt;3
93001063;PROGRAMA DE INTERCAMBIO OPTATIVA 3 ECTS 3;;1;2S;opt;3
93001064;PROGRAMA DE INTERCAMBIO PRACTICAS 3 ECTS ;;1;2S;;3
93001065;PROGRAMA DE INTERCAMBIO PRACTICAS 6 ECTS ;;1;2S;;6
93001066;PROGRAMA DE INTERCAMBIO PRACTICAS 12 ECTS;;1;2S;;12
93001067;PROGRAMA DE INTERCAMBIO PRACTICAS 15 ECTS;;1;2S;;15
93001068;PRACTICAS COMPLEMENTOS TFM;;1;1S;opt;15
93001069;FROM ARRAY PROCESSING TO MIMO COMMUNICATIONS;;2;2S;opt;6
93001070;PREDICTIVE AND DESCRIPTIVE LEARNING;;2;1S;opt;6
93001071;DATA SCIENCE FOUNDATIONS AND APPLICATIONS;;2;1S;opt;2
93001072;MACHINE LEARNING LAB ;;2;1S;opt;4.5
93001073;BLOCKCHAIN: DESARROLLO DE APLICACIONES;;2;1S;opt;3
93001074;BLOCKCHAIN: FUNDAMENTOS Y ARQUITECTURAS;;2;2S;opt;3
93001075;PRÁCTICAS EXTERNAS;;1;I;opt;8
93001080;REDES DEFINIDAS POR SOFTWARE Y VIRTUALIZACIÓN DE REDES;;1;1S;obl;6
93001081;GESTIÓN Y OPERACIÓN DE LA CIBERSEGURIDAD Y PRIVACIDAD;;1;2S;obl;6
93001082;INGENIERÍA DE SERVICIOS TELEMÁTICOS;;1;1S;obl;6
93001083;ANALÍTICA DE BIG DATA;;1;2S;obl;6
93001084;EVOLUCIÓN DE REDES INALÁMBRICAS I (5G, VSAT, DTN, IOT);;1;1S;opt;3
93001085;EVOLUCIÓN DE REDES INALÁMBRICAS II (5G, VSAT, DTN, IOT);;1;2S;opt;3
93001086;SIMULACIÓN DE REDES DE COMUNICACIONES;;1;1S;opt;3
93001087;TECNOLOGÍAS PARA APLICACIONES Y SERVICIOS DE INTERNET;;1;2S;opt;3
93001088;FUNDAMENTOS DE BIG DATA;;1;1S;opt;3
93001089;SISTEMAS DE INFORMACIÓN Y BASES DE DATOS;;1;1S;opt;3
93001090;BLOCKCHAIN: DESARROLLO DE APLICACIONES;;1;1S;opt;3
93001091;FUNDAMENTOS DE LA COMPUTACIÓN EN LA NUBE;;1;1S;opt;3
93001092;ARQUITECTURA DE SERVICIOS PARA IOT;;1;2S;opt;3
93001093;BLOCKCHAIN: FUNDAMENTOS Y ARQUITECTURAS;;1;2S;opt;3
93001094;PRÁCTICAS EXTERNAS 6;;1;I;opt;6
93001095;PRÁCTICAS EXTERNAS 3A;;1;I;opt;3
93001096;PRÁCTICAS EXTERNAS 3B;;1;I;opt;3
93001097;SEMINARIOS PROFESIONALES;;1;A;opt;3
93001098;MINI-PROYECTOS;;1;A;opt;3
93001099;TRABAJO FIN DE MÁSTER;;1;I;obl;12
95000001;ALGEBRA;ÁLGE;1;1S;bas;6
95000002;CALCULO;CÁLC;1;1S;bas;6
95000003;FÍSICA GENERAL I;FIS1;1;1S;bas;6
95000004;INTRODUCCIÓN A LA INGENIERIA DE TELECOMUNICACIÓN;INIT;1;1S;obl;3
95000005;FUNDAMENTOS DE  LOS SISTEMAS TELEMATICOS;FTEL;1;1S;obl;4.5
95000006;FISICA GENERAL 2;FIS2;1;2S;obl;4.5
95000007;ANÁLISIS VECTORIAL;AVEC;1;2S;bas;6
95000008;INTRODUCCIÓN AL ANÁLISIS DE CIRCUITOS;IACR;1;1S;bas;4.5
95000009;INTRODUCCIÓN A LA ELECTRÓNICA;INEL;1;2S;bas;4.5
95000010;PROGRAMACION;PRG;1;2S;bas;6
95000011;INGLÉS I. ENGLISH FOR ACADEMICA AND PROFESSIONAL COMMUNICATION I -  READING AND WRITING SKILLS;IGL1;2;1S-2S;obl;3
95000012;FUNDAMENTOS DE GESTIÓN EMPRESARIAL;FGST;1;2S;bas;4.5
95000013;ELECTROMAGNETISMO;ELMG;2;1S;bas;4.5
95000014;ELECTRONICA E INSTRUMENTACION BASICAS;EINB;2;1S;bas;4.5
95000015;SEÑALES Y SISTEMAS;SSIT;2;1S;bas;6
95000016;SEÑALES ALEATORIAS;SALT;2;1S;obl;4.5
95000017;INGLÉS II. ENGLISH FOR ACADEMICA AND PROFESSIONAL COMMUNICATION II – LISTENING AND SPEAKING SKILL;IGL2;2;1S-2S;obl;3
95000018;ELECTRÓNICA DIGITAL;EDIG;2;1S;obl;3
95000019;MÉTODOS MATEMÁTICOS;MMAT;1;2S;bas;4.5
95000020;ELECTRÓNICA ANALÓGICA;ELAN;2;2S;obl;3
95000021;TEORÍA DE LA COMUNICACIÓN;TECM;2;2S;obl;6
95000022;CAMPOS Y ONDAS EN TELECOMUNICACIÓN;COTE;2;2S;obl;4.5
95000023;REDES Y SERVICIOS DE TELECOMUNICACIÓN;RSTC;2;2S;obl;6
95000024;ANÁLISIS Y DISEÑO DEL SOFTWARE;ADSW;2;2S;obl;4.5
95000025;CIRCUITOS ELECTRÓNICOS;CELT;3;1S;obl;3
95000026;SISTEMAS DIGITALES I;SDG1;3;1S;obl;4.5
95000027;TEORÍA DE LA INFORMACIÓN;TINF;3;1S;obl;4.5
95000028;TRATAMIENTO DIGITAL DE SEÑALES;TDSÑ;3;1S;obl;6
95000029;ANÁLISIS Y DISEÑO DE CIRCUITOS;ADCT;2;2S;obl;3
95000030;SISTEMAS DE TRANSMISIÓN;STRA;3;1S;obl;4.5
95000031;REDES DE ORDENADORES;RDOR;3;1S;obl;4.5
95000032;ORGANIZACIÓN DE EMPRESAS;ORGE;3;2S;obl;4.5
95000033;SISTEMAS DIGITALES II;SDG2;3;2S;obl;3
95000034;SISTEMAS DE ENERGIA;ENRG;3;2S;obl;4.5
95000035;RADIACION Y PROPAGACION;RDPR;3;1S;obl;3
95000036;COMUNICACIONES ÓPTICAS;COPT;3;1S-2S;obl;4.5
95000037;ELECTRÓNICA DE COMUNICACIONES;ECOM;3;2S;obl;4.5
95000038;COMPUTACIÓN EN RED;CORE;3;2S;obl;4.5
95000040;MICROONDAS;MICR;4;1S;opt;4.5
95000041;RADIOCOMUNICACIONES;RCOM;4;1S;opt;6
95000042;TRANSMISIÓN DIGITAL;TRDG;4;1S;opt;6
95000043;ANTENAS;ANTE;4;1S;opt;4.5
95000044;COMUNICACIONES MÓVILES;CMOV;4;2S;opt;6
95000045;SISTEMAS DE RADIODETERMINACIÓN;RDET;4;2S;opt;4.5
95000046;SISTEMAS DE TELECOMUNICACIÓN;STEL;4;1S;opt;6
95000047;SUBSISTEMAS DE RADIOFRECUENCIA;SURF;4;2S;opt;4.5
95000050;REDES CORPORATIVAS;RECO;4;1S;opt;6
95000051;SEGURIDAD EN SISTEMAS  Y REDES DE TELECOMUNICACIÓN;SEGU;4;1S;opt;4.5
95000052;REDES DE COMUNICACIONES MÓVILES;RCMO;4;1S;opt;6
95000053;INGENIERÍA WEB;IWEB;4;1S;opt;6
95000054;CENTROS DE DATOS Y DE PROVISIÓN DE SERVICIOS;CDPS;4;1S;opt;4.5
95000055;REDES Y SERVICIOS DE RADIO;RSRD;4;2S;opt;4.5
95000056;DIMENSIONADO Y OPERACIÓN DE REDES;DORE;4;2S;opt;6
95000057;INGENIERÍA DE SISTEMAS Y SERVICIOS TELEMÁTICOS;ISST;4;2S;opt;4.5
95000060;DISEÑO DE SISTEMAS ELECTRÓNICOS DIGITALES;DSED;4;1S;opt;6
95000061;ARQUITECTURA DE PROCESADORES;ARQU;4;1S;opt;4.5
95000062;FABRICACIÓN DE EQUIPOS ELECTRÓNICOS;FEEL;4;1S;opt;4.5
95000063;SISTEMAS ELECTRÓNICOS ANALÓGICOS Y MIXTOS;SEAM;4;1S;opt;6
95000064;INSTRUMENTACION ELECTRONICA;IELE;4;1S;opt;6
95000065;INGENIERÍA DE SISTEMAS ELECTRÓNICOS;ISEL;4;2S;opt;4.5
95000066;SISTEMAS ELECTRÓNICOS DE CONTROL;SECO;4;2S;opt;4.5
95000067;SISTEMAS PARA CONECTIVIDAD;SCON;4;2S;opt;3
95000068;ELECTRONICA DE CONSUMO;ELCO;4;2S;opt;3
95000070;TRATAMIENTO DIGITAL DE VOZ Y AUDIO;TDVA;4;1S;opt;6
95000071;TRATAMIENTO DIGITAL DE IMÁGENES Y VÍDEO;TDIV;4;1S;opt;6
95000072;EQUIPOS Y SISTEMAS AUDIOVISUALES;EQSA;4;1S;opt;6
95000073;DIFUSIÓN Y SERVICIOS DE RED;DSRE;4;2S;opt;6
95000074;COMUNICACIONES AUDIOVISUALES;CMAV;4;2S;opt;6
95000075;TELEVISION;TV;4;1S;opt;6
95000076;PRODUCCIÓN MULTIMEDIA;PROD;4;2S;opt;6
95000077;HERRAMIENTAS PARA LA COMPUTACIÓN Y VISUALIZACIÓN;HCOV;2;1S-2S;opt;4.5
95000078;ESTRUCTURA DE LA MATERIA;ESMT;2;2S;opt;4.5
95000079;DIBUJO POR ORDENADOR;DBOR;2;1S;opt;4.5
95000080;SISTEMAS DE CÁLCULO SIMBÓLICO;SCAS;2;1S;opt;4.5
95000082;TRABAJO FIN DE GRADO;TFG;4;1S-2S;opt;12
95000083;TECNOLOGÍAS WEB DE CLIENTE;TEWC;2;2S;opt;4.5
95000086;FOTONICA DE CONSUMO;FOCO;2;1S;opt;4.5
95000087;LABORATORIO DE TÉCNICAS ELECTRO-TERMOQUÍMICAS;LTET;2;2S;opt;4.5
95000088;INSTALACIONES ELÉCTRICAS;INSE;3;1S;opt;4.5
95000089;INTRODUCCIÓN A LA ROBÓTICA INTELIGENTE;IRIN;3;2S;opt;4.5
95000090;NANOTECNOLOGÍA PARA LA INFORMACIÓN Y LAS COMUNICACIONES;NTIC;3;1S;opt;4.5
95000092;INGENIERIA DE TELECOMUNICACION EN COOPERACION PARA EL DESARROLLO;ITCD;3;2S;opt;4.5
95000094;BIOINGENIERÍA Y TELECOMUNICACIÓN;BITC;3;2S;opt;4.5
95000096;SISTEMAS DE INFORMACIÓN GEOGRÁFICA Y TERRITORIAL;SIGT;3;2S;opt;4.5
95000098;INTRODUCCIÓN A LOS ENTORNOS INTELIGENTES;IEIN;2;2S;opt;4.5
95000100;TRABAJO FIN DE GRADO;;4;1S-2S;obl;12
95000101;MATEMÁTICAS I;MAT1;1;1S;bas;6
95000102;FÍSICA;FISC;1;1S;bas;6
95000103;QUÍMICA;QUIM;1;1S;bas;6
95000104;BIOLOGIA;BIOL;1;1S;bas;6
95000105;ESTADISTICA;ESTD;1;2S;bas;6
95000106;MATEMATICAS II;MAT2;1;2S;bas;6
95000107;BIOQUÍMICA ESTRUCTURAL;BQST;1;2S;obl;6
95000108;BIOLOGÍA CELULAR Y TISULAR;BICT;1;2S;obl;6
95000109;FUNDAMENTOS DE PROGRAMACION;FPRG;1;1S;bas;6
95000110;FUNDAMENTOS DE BIOMECÁNICA;FBMC;2;1S;obl;6
95000111;USO PROFESIONAL DE LA LENGUA INGLESA;UPLI;2;2S;bas;6
95000112;ANALISIS INSTRUMENTAL;AINS;2;1S;obl;6
95000113;BIOMECÁNICA DE MEDIOS CONTINUOS;BIMC;2;2S;obl;6
95000114;MATEMATICAS III;MAT3;2;1S;obl;6
95000115;FÍSICA II ;FIS2;1;2S;bas;6
95000116;FUNDAMENTOS DE ELECTRÓNICA;FELT;2;1S;bas;6
95000117;FISIOLOGÍA DE SISTEMAS;FSIT;2;2S;obl;6
95000118;ECONOMIA Y GESTION DE EMPRESAS;ECON;2;1S;obl;6
95000119;SISTEMAS Y SEÑALES;SSIT;2;2S;obl;6
95000120;SISTEMAS ELECTRÓNICOS;SELC;2;2S;obl;6
95000121;SEÑALES BIOMEDICAS;SBIO;3;1S;obl;6
95000122;FISIOPATOLOGÍA HUMANA;FISH;3;1S;obl;6
95000123;MODELOS NUMÉRICOS EN BIOMEDICINA;MNUB;3;1S;obl;6
95000124;BASES DE DATOS;BBDD;3;2S;obl;6
95000125;BIOINSTRUMENTACION;BINS;3;2S;obl;6
95000126;IMAGENES BIOMEDICAS;IMAG;3;2S;obl;6
95000127;BIOMATERIALES;BMAT;3;2S;obl;6
95000128;REDES DE COMUNICACIONES;RCOM;3;1S;obl;6
95000129;ARQUITECTURA DE COMPUTADORES Y SSOO;ARSO;3;2S;obl;6
95000130;ALGORITMOS Y ESTRUCTURAS DE DATOS;ALED;3;1S;obl;6
95000150;LABORATORIO DE IMAGENES BIOMEDICAS;LIM;4;1S;opt;4
95000151;INGENIERIA CLINICA Y DE GESTION DE SISTEMAS SANITARIOS;ICL;4;1S;obl;4
95000152;MODELADO Y SIMULACION DINAMICA APLICADA A LA BIOMEDICINA;MOD;4;1S;opt;4
95000153;LABORATORIO DE SEÑALES BIOMEDICAS;LSB;4;1S;opt;4
95000154;LABORATORIO DE BIOINSTRUMENTACION;LBI;4;1S;opt;4
95000155;INGENIERÍA DE TEJIDOS;IT;4;1S;obl;4
95000156;LABORATORIO DE MATERIALES BIOLOGICOS Y BIOMATERIALES;LMBB;4;2S;opt;4
95000157;BIOSENSORES;BSEN;4;2S;obl;4
95000158;DESARROLLO DE DISPOSITIVOS MEDICOS;DDIS;4;2S;opt;4
95000159;LABORATORIO DE BIOMECANICA;LBMC;4;2S;opt;4
95000160;HISTORIAS CLINICAS, TERMINOLOGIAS Y ESTANDARES;HCTE;4;2S;opt;4
95000161;SISTEMAS DE INFORMACION BIOMEDICA;SIB;4;1S;opt;4
95000162;SISTEMAS DE AYUDA A LA DECISION MEDICA;SAD;4;2S;opt;4
95000163;BIOINFORMÁTICA ;;4;1S;obl;4
95000164;MINERÍA DE DATOS EN BIOMEDICINA;;4;2S;obl;4
95000165;NLP Y RECUPERACION DE INFORMACION;;4;2S;opt;4
95000166;TECNOLOGIAS WEB EN BIOMEDICINA;;4;1S;opt;4
95000167;BASES DE DATOS Y SISTEMAS DE SALUD PUBLICA;;4;1S;opt;4
95000168;e-HEALTH;;4;2S;obl;4
95000169;TELEMEDICINA;TLM;4;2S;opt;4
95000170;REDES Y SERVICIOS;RSER;4;1S;opt;4
95000171;TRATAMIENTO DIGITAL DE IMÁGENES BIOMÉDICAS;TDI;4;1S;obl;4
95000172;INTERFACES HOMBRE-MÁQUINA;IHM;4;1S;obl;4
95000173;LABORATORIO DE TELEMEDICINA;LTLM;4;2S;obl;4
95000174;TECNOLOGIAS SISTEMAS PERSONALES SANITARIOS;;4;2S;opt;4
95000175;TECNOLOGÍAS ASISTIVAS;;4;2S;opt;4
95000176;INGENIERIA NEUROSENSORIAL;INS;4;2S;opt;4
95000177;IMAGENES BIOMEDICAS AVANZADAS I;IBA;4;1S;opt;4
95000178;SIMULACION Y PLANIFICACION QUIRURGICA;SIP;4;2S;opt;4
95000179;IMÁGENES BIOMÉDICAS AVANZADAS II;IMA2;4;2S;obl;4
95000180;BIOFOTONICA;BFT;4;2S;opt;4
95000181;PROGRAMAS DE INTERCAMBIO OBL.ITIN.4ºCURSO 1ER SEMESTRE;;4;1S;opt;27
95000182;PROGRAMAS DE INTERCAMBIO OBL.ITIN.4ºCURSO 1ER SEMESTRE;;4;1S;opt;30
95000183;PROGRAMAS DE INTERCAMBIO OBL.ITIN.4ºCURSO 2DO SEMESTRE;;4;2S;opt;15
95000184;PROGRAMAS DE INTERCAMBIO OBL.ITIN.4ºCURSO 2DO SEMESTRE;;4;1S-2S;opt;12
95000185;PROGRAMAS DE INTERCAMBIO OPTATIVAS 4ºCURSO 3 ECTS;;4;1S-2S;opt;3
95000186;PROGRAMAS DE INTERCAMBIO OPTATIVAS 4ºCURSO 6 ECTS;;4;1S-2S;opt;6
95000190;GESTIÓN EFICAZ DE EQUIPOS DE TRABAJO;GEET;4;1S-2S;opt;3
95000191;DESARROLLO PERSONAL Y GESTIÓN DE CARRERA;DPGC;4;1S-2S;opt;3
95000192;CREATIVIDAD E INNOVACION;CRIN;4;2S;opt;3
95000193;CREATIVIDAD Y EMPRENDIMIENTO EN LOS SISTEMAS TIC;;4;2S;opt;3
95000194;PRACTICAS EXTERNAS 2;;4;I;opt;2
95000195;PRACTICAS EXTERNAS 3;;4;I;opt;3
95000196;PRACTICAS EXTERNAS 4;;4;I;opt;4
95000197;PRACTICAS EXTERNAS 5;;4;I;opt;5
95000198;PRACTICAS EXTERNAS;;4;I;opt;4
95000199;PRACTICAS EXTERNAS;;4;I;opt;4
95000200;PROGRAMAS DE INTERCAMBIO OBL ITIN;;4;I;opt;9
95000201;PROGRAMAS DE INTERCAMBIO OBL ITIN;;4;I;opt;6
95000202;PROGRAMAS DE INTERCAMBIO OBL ITIN;;4;I;opt;4.5
95000203;PROGRAMAS DE INTERCAMBIO OBL ITIN;;4;I;opt;3
95000204;PROGRAMAS DE INTERCAMBIO OBL ITIN;;4;I;opt;4
95000205;PROGRAMAS DE INTERCAMBIO OBL ITIN;;4;I;opt;8
95000206;PROGRAMAS DE INTERCAMBIO OPTATIVAS;;4;I;opt;4
95000207;PROGRAMAS DE INTERCAMBIO OPTATIVAS;;4;I;opt;8
95000208;PROGRAMAS DE INTERCAMBIO OBL TFG;;4;I;opt;12
95000209;PRACTICAS EXTERNAS;;4;I;opt;3
95000210;PRACTICAS EXTERNAS;;4;I;opt;5
95000211;PRACTICAS EXTERNAS;;4;I;opt;6
95000212;PROGRAMAS DE INTERCAMBIO OBL ITIN 9 CREDS;;4;I;opt;9
95000213;PROGRAMAS DE INTERCAMBIO OBL ITIN 6 CREDS;;4;I;opt;6
95000214;PROGRAMAS DE INTERCAMBIO OBL ITIN 4,5 CREDS;;4;I;opt;4.5
95000215;PROGRAMAS DE INTERCAMBIO OBL ITIN 3 CREDS;;4;I;opt;3
95000216;PROGRAMAS DE INTERCAMBIO OBL ITIN 4 CREDS;;4;I;opt;4
95000217;PROGRAMAS DE INTERCAMBIO OBL ITIN 8 CREDS;;4;I;opt;8
95000218;PROGRAMA INTERCAMBIO AYUDA A LA DECISION (4);;4;I;opt;4
