codigo;nombre;acronimo;curso;semestre;tipo;creditos
95000219;PROGRAMA INTERCAMBIO BASES DE DATOS I (4);;4;I;opt;4
95000220;PROGRAMA INTERCAMBIO BASES DE DATOS II (8);;4;I;opt;8
95000221;PROGRAMA INTERCAMBIO BIOINFORMATICA (4);;4;I;opt;4
95000222;PROGRAMA INTERCAMBIO BIOMATERIALES I (4);;4;I;opt;4
95000223;PROGRAMA INTERCAMBIO BIOMATERIALES II (4);;4;I;opt;4
95000224;PROGRAMA INTERCAMBIO BIOMECANICA (4);;4;I;opt;4
95000225;PROGRAMA INTERCAMBIO DISPOSITIVOS BIOMEDICOS I (4);;4;I;opt;4
95000226;PROGRAMA INTERCAMBIO DISPOSITIVOS BIOMEDICOS II (8);;4;I;opt;8
95000227;PROGRAMA INTERCAMBIO EMPRESA (4);;4;I;obl;4
95000228;PROGRAMA INTERCAMBIO GESTION DE INFORMACION BIOMEDICA I (4);;4;I;opt;4
95000229;PROGRAMA INTERCAMBIO GESTION DE INFORMACION BIOMEDICA II (4);;4;I;opt;4
95000230;PROGRAMA INTERCAMBIO GESTION DE INFORMACION BIOMEDICA III (8);;4;I;opt;8
95000231;PROGRAMA INTERCAMBIO INTERFACES (4);;4;I;opt;4
95000232;PROGRAMA INTERCAMBIO METODOS NUMERICOS (4);;4;I;opt;4
95000233;PROGRAMA INTERCAMBIO SEÑALES E IMAGENES BIOMEDICAS I (4);;4;I;opt;4
95000234;PROGRAMA INTERCAMBIO SEÑALES E IMAGENES BIOMEDICAS II (8);;4;I;opt;8
95000235;PROGRAMA INTERCAMBIO SEÑALES E IMAGENES BIOMEDICAS III (12);;4;I;opt;12
95000236;PROGRAMA INTERCAMBIO TELEMEDICINA I (4);;4;I;opt;4
95000237;PROGRAMA INTERCAMBIO TELEMEDICINA II (8);;4;I;opt;8
95000238;PROGRAMA INTERCAMBIO OPTATIVA I (2);;4;I;opt;2
95000239;PROGRAMA INTERCAMBIO OPTATIVA II (3);;4;I;opt;3
95000240;PROGRAMA INTERCAMBIO OPTATIVA III (4);;4;I;opt;4
95000241;PROGRAMA INTERCAMBIO OPTATIVA IV (4);;4;I;opt;4
95000242;INFRAESTRUCTURA DE DATOS ESPACIALES;IDE;2;2S;opt;4.5
95000244;SISTEMAS BASADOS EN APRENDIZAJE AUTOMÁTICO;SIBA;4;1S;opt;3
95000245;ERGONOMÍA DE INTERACCIÓN PERSONA-MÁQUINA;EIPM;4;1S;opt;3
95000246;INGENIERÍA DE LA MÚSICA;IMUS;4;1S;opt;3
